板块,舆论分,正向词命中,负向词命中,中性词命中,宏观词命中,命中关键词,标题,新闻片段
光伏,-1.0,1,0,0,10,储能,李强同西班牙首相会谈,李强同西班牙首相会谈 欢迎仪式后，李强同桑切斯举行会谈。李强表示，中国和西班牙作为世界主要经济体，共同维护多边主义和自由贸易，坚定推动开放合作，为两国乃至全球发展增添了动能。越是国际形势变乱交织，中西两国越要加强务实合作，相互赋能、相互成就
跨境出海,12.5,14,0,1,6,一带一路,今年一季度我国货物贸易进出口规模创历史同期新高,今年一季度我国货物贸易进出口规模创历史同期新高 国务院新闻办公室今天（4月14日）上午举行新闻发布会。海关总署介绍，今年一季度，我国货物贸易进出口超11万亿元，创历史同期新高，季度增速创近5年最高。在复杂严峻的外部环境下，我国外贸起势有力、
军工,-0.5,0,0,1,1,国防,美称对伊朗海上交通封锁已生效 伊朗称已准备好回应敌方任何冒险行为,美称对伊朗海上交通封锁已生效 伊朗称已准备好回应敌方任何冒险行为 美国总统特朗普13日在接受媒体采访时称，美国对伊朗海上交通的封锁当天已生效。如果伊朗的快速攻击艇靠近美军封锁区，将立即被摧毁。根据美国军方发布的消息，美军在阿曼湾和霍尔木兹海
低空经济,-0.5,0,0,1,1,通航,国际联播快讯,国际联播快讯 以扩大在黎地面行动 真主党称抵抗到底以色列国防军13日称，正扩大在黎巴嫩南部的地面行动，当天打击了约150个黎巴嫩真主党目标。同一天，黎真主党继续向以色列境内目标发射火箭弹。黎真主党领导人卡西姆13日表示，以色列和美国试图解除
军工,-0.5,0,0,1,1,国防,国际联播快讯,国际联播快讯 以扩大在黎地面行动 真主党称抵抗到底以色列国防军13日称，正扩大在黎巴嫩南部的地面行动，当天打击了约150个黎巴嫩真主党目标。同一天，黎真主党继续向以色列境内目标发射火箭弹。黎真主党领导人卡西姆13日表示，以色列和美国试图解除
