板块,舆论分,正向词命中,负向词命中,中性词命中,宏观词命中,命中关键词,标题,新闻片段
人工智能,2.8,5,0,0,11,AI,一季度全国期货市场服务实体经济能力持续增强,一季度全国期货市场服务实体经济能力持续增强 中国期货业协会公布的最新数据显示，1—3月全国期货市场累计成交量为26.01亿手，累计成交额为256.71万亿元，同比分别增长40.64%和58.43%，期货市场服务实体经济能力持续增强。从3月份
新能源车,2.0,4,0,0,10,电池,我国氢能产业加速打开万亿新空间,我国氢能产业加速打开万亿新空间 “十五五”规划纲要提出，要推动氢能、核聚变能等成为新的经济增长点。今年以来，我国氢能产业正加速从技术示范探索，迈入规模化、商业化发展的新阶段。海水无需淡化可以直接制成氢气。在渤海湾，我国首个百千瓦级工厂化海水
人工智能,1.9,4,0,1,9,人工智能,国内联播快讯,国内联播快讯 2026年共和国部长义务植树活动在京举行2026年共和国部长义务植树活动今天（4月11日）在北京通州举行。活动以“履行植树义务 共建美丽中国”为主题，来自中共中央直属机关、中央国家机关各部门和北京市的130名部级领导干部参加。
军工,-0.6,0,0,2,0,战机,美国和伊朗谈判定于今日在巴基斯坦首都举行,美国和伊朗谈判定于今日在巴基斯坦首都举行 美国和伊朗谈判定于今天（4月11日）在巴基斯坦首都伊斯兰堡举行。双方代表团分别由伊朗伊斯兰议会议长卡利巴夫和美国副总统万斯率领。今天下午，巴基斯坦总理夏巴兹分别与双方代表团举行会谈。伊朗称做好捍卫自
低空经济,-0.3,0,0,1,0,无人机,以军袭击致十余名黎巴嫩政府工作人员死亡,以军袭击致十余名黎巴嫩政府工作人员死亡 以色列国防军10日发表声明称，在过去24小时内，以军空袭了位于黎巴嫩南部的120多处黎真主党目标。黎巴嫩国家安全总局10日称，以色列当天空袭黎南部城市纳巴提耶政府大楼，该大楼内设有国家安全总局纳巴提耶
军工,-0.3,0,0,1,0,国防|导弹,以军袭击致十余名黎巴嫩政府工作人员死亡,以军袭击致十余名黎巴嫩政府工作人员死亡 以色列国防军10日发表声明称，在过去24小时内，以军空袭了位于黎巴嫩南部的120多处黎真主党目标。黎巴嫩国家安全总局10日称，以色列当天空袭黎南部城市纳巴提耶政府大楼，该大楼内设有国家安全总局纳巴提耶
